<?xml version="1.0" encoding="UTF-8"?>
<!DOCTYPE ticket SYSTEM "DTD.dtd" >
    <ticket>
        <policlinic>
            <city>
                Minsk
            </city>
            <name>
                12's city policlinic
            </name>
            <doctor>
                <post>
                    cardiologist
                </post>
                <name>
                    Martin
                </name>
                <surname>
                    Jonson
                </surname>
                <category>
                    first
                </category>
                <cabinet>
                    434
                </cabinet>
            </doctor>
        </policlinic>
        <visitDate>
            <date>
                2016 12 14
            </date>
            <time>
                13:56
            </time>
        </visitDate>
        <patient>
            <name>
                Tom
            </name>
            <surname>
                Hakins
            </surname>
            <birthDay>
                    1978 09 30
            </birthDay>
            <address>
                <city>
                    Minsk
                </city>
                <street>
                    Nezavisimosti
                </street>
                <house>
                    132
                </house>
                <room>
                    14
                </room>
            </address>
        </patient>
    </ticket>